{
  "version": "2.1.0",
  "enterprise_type": "insurance",
  "statement_template": [
    {
      "item_id": "CFO-I01",
      "name": "收到原保险合同保费取得的现金",
      "section": "operating",
      "display_order": 10
    },
    {
      "item_id": "CFO-I02",
      "name": "收到再保业务现金净额",
      "section": "operating",
      "display_order": 20
    },
    {
      "item_id": "CFO-I03",
      "name": "保户储金及投资款净增加额",
      "section": "operating",
      "display_order": 30
    },
    {
      "item_id": "CFO-I05",
      "name": "收取利息、手续费及佣金的现金",
      "section": "operating",
      "display_order": 40
    },
    {
      "item_id": "CFO-I06",
      "name": "收到其他与经营活动有关的现金",
      "section": "operating",
      "display_order": 50
    },
    {
      "item_id": "CFO-IN",
      "name": "经营活动现金流入小计",
      "section": "operating",
      "display_order": 60
    },
    {
      "item_id": "CFO-I07",
      "name": "支付原保险合同赔付款项的现金",
      "section": "operating",
      "display_order": 70
    },
    {
      "item_id": "CFO-I08",
      "name": "支付再保业务现金净额",
      "section": "operating",
      "display_order": 80
    },
    {
      "item_id": "CFO-I-POLICY-OUT",
      "name": "保户储金及投资款净减少额",
      "section": "operating",
      "display_order": 85
    },
    {
      "item_id": "CFO-I09",
      "name": "支付保单红利的现金",
      "section": "operating",
      "display_order": 90
    },
    {
      "item_id": "CFO-I-TRADING",
      "name": "为交易目的而持有的金融资产净增加额",
      "section": "operating",
      "display_order": 100
    },
    {
      "item_id": "CFO-I-LENT",
      "name": "拆出资金净增加额",
      "section": "operating",
      "display_order": 110
    },
    {
      "item_id": "CFO-I-REVERSE-REPO",
      "name": "返售业务资金净增加额",
      "section": "operating",
      "display_order": 120
    },
    {
      "item_id": "CFO-I-FEE",
      "name": "支付手续费及佣金的现金",
      "section": "operating",
      "display_order": 130
    },
    {
      "item_id": "CFO-I-EMP",
      "name": "支付给职工及为职工支付的现金",
      "section": "operating",
      "display_order": 140
    },
    {
      "item_id": "CFO-I-TAX",
      "name": "支付的各项税费",
      "section": "operating",
      "display_order": 150
    },
    {
      "item_id": "CFO-I-OTHER-OUT",
      "name": "支付其他与经营活动有关的现金",
      "section": "operating",
      "display_order": 160
    },
    {
      "item_id": "CFO-OUT",
      "name": "经营活动现金流出小计",
      "section": "operating",
      "display_order": 170
    },
    {
      "item_id": "CFO-NET",
      "name": "经营活动产生的现金流量净额",
      "section": "operating",
      "display_order": 180
    },
    {
      "item_id": "CFI-01",
      "name": "收回投资收到的现金",
      "section": "investing",
      "display_order": 190
    },
    {
      "item_id": "CFI-02",
      "name": "取得投资收益收到的现金",
      "section": "investing",
      "display_order": 200
    },
    {
      "item_id": "CFI-03",
      "name": "处置固定资产、无形资产和其他长期资产收回的现金净额",
      "section": "investing",
      "display_order": 210
    },
    {
      "item_id": "CFI-05",
      "name": "收到其他与投资活动有关的现金",
      "section": "investing",
      "display_order": 220
    },
    {
      "item_id": "CFI-IN",
      "name": "投资活动现金流入小计",
      "section": "investing",
      "display_order": 230
    },
    {
      "item_id": "CFI-07",
      "name": "投资支付的现金",
      "section": "investing",
      "display_order": 240
    },
    {
      "item_id": "CFI-I-REVERSE-REPO",
      "name": "返售业务资金净增加额",
      "section": "investing",
      "display_order": 250
    },
    {
      "item_id": "CFI-I-PLEDGE",
      "name": "质押贷款净增加额",
      "section": "investing",
      "display_order": 260
    },
    {
      "item_id": "CFI-06",
      "name": "购建固定资产、无形资产和其他长期资产支付的现金",
      "section": "investing",
      "display_order": 270
    },
    {
      "item_id": "CFI-09",
      "name": "支付其他与投资活动有关的现金",
      "section": "investing",
      "display_order": 280
    },
    {
      "item_id": "CFI-OUT",
      "name": "投资活动现金流出小计",
      "section": "investing",
      "display_order": 290
    },
    {
      "item_id": "CFI-NET",
      "name": "投资活动产生的现金流量净额",
      "section": "investing",
      "display_order": 300
    },
    {
      "item_id": "CFF-01",
      "name": "吸收投资收到的现金",
      "section": "financing",
      "display_order": 310
    },
    {
      "item_id": "CFF-02",
      "name": "取得借款收到的现金",
      "section": "financing",
      "display_order": 320
    },
    {
      "item_id": "CFF-BOND",
      "name": "发行债券收到的现金",
      "section": "financing",
      "display_order": 330
    },
    {
      "item_id": "CFF-I-REPO",
      "name": "回购业务资金净增加额",
      "section": "financing",
      "display_order": 340
    },
    {
      "item_id": "CFF-03",
      "name": "收到其他与筹资活动有关的现金",
      "section": "financing",
      "display_order": 350
    },
    {
      "item_id": "CFF-IN",
      "name": "筹资活动现金流入小计",
      "section": "financing",
      "display_order": 360
    },
    {
      "item_id": "CFF-04",
      "name": "偿还债务支付的现金",
      "section": "financing",
      "display_order": 370
    },
    {
      "item_id": "CFF-05",
      "name": "分配股利、利润或偿付利息支付的现金",
      "section": "financing",
      "display_order": 380
    },
    {
      "item_id": "CFF-06",
      "name": "支付其他与筹资活动有关的现金",
      "section": "financing",
      "display_order": 390
    },
    {
      "item_id": "CFF-OUT",
      "name": "筹资活动现金流出小计",
      "section": "financing",
      "display_order": 400
    },
    {
      "item_id": "CFF-NET",
      "name": "筹资活动产生的现金流量净额",
      "section": "financing",
      "display_order": 410
    },
    {
      "item_id": "FX",
      "name": "汇率变动对现金及现金等价物的影响",
      "section": "cash",
      "display_order": 420
    },
    {
      "item_id": "NET-CASH",
      "name": "现金及现金等价物净增加额",
      "section": "cash",
      "display_order": 430
    },
    {
      "item_id": "OPENING-CASH",
      "name": "加：期初现金及现金等价物余额",
      "section": "cash",
      "display_order": 440
    },
    {
      "item_id": "CLOSING-CASH",
      "name": "期末现金及现金等价物余额",
      "section": "cash",
      "display_order": 450
    }
  ],
  "account_groups": {
    "cash_and_equivalents": [
      "库存现金",
      "银行存款",
      "其他货币资金",
      "现金等价物"
    ],
    "notes_receivable": [
      "应收票据"
    ],
    "accounts_receivable": [
      "应收账款"
    ],
    "contract_assets": [
      "合同资产"
    ],
    "advances_from_customers": [
      "预收账款"
    ],
    "contract_liabilities": [
      "合同负债"
    ],
    "inventory": [
      "存货"
    ],
    "trade_payables": [
      "应付账款"
    ],
    "notes_payable": [
      "应付票据"
    ],
    "trade_prepayments": [
      "预付账款"
    ],
    "employee_benefits_payable_operating": [
      "应付职工薪酬"
    ],
    "capex_payables": [
      "应付工程款",
      "应付设备款"
    ],
    "capex_employee_payables": [
      "在建工程人员应付职工薪酬"
    ],
    "capex_prepayments": [
      "预付工程款",
      "预付设备款"
    ]
  },
  "statement_mapping": [
    {
      "report_item": "货币资金",
      "statement": "balance_sheet",
      "amount_mode": "balance",
      "account_code_prefixes": [
        "1001",
        "1002",
        "1012"
      ]
    },
    {
      "report_item": "营业收入",
      "statement": "income_statement",
      "amount_mode": "credit_minus_debit",
      "account_code_prefixes": [
        "6001",
        "6051"
      ]
    },
    {
      "report_item": "营业成本",
      "statement": "income_statement",
      "amount_mode": "debit_minus_credit",
      "account_code_prefixes": [
        "6401",
        "6402"
      ]
    }
  ],
  "control_destinations": [
    {
      "source": "audited_balance_sheet_changes",
      "required": true
    },
    {
      "source": "audited_income_statement",
      "required": true
    },
    {
      "source": "adjustment_bridge",
      "required": true
    }
  ],
  "items": [
    {
      "item_id": "CFO-I01",
      "name": "收到原保险合同保费取得的现金",
      "section": "operating",
      "display_order": 10,
      "verification_record_id": "FV-INSURANCE-FORMAT-2018-R2",
      "components": [
        {
          "component_id": "CFO-I01-C01",
          "operation": "fact_amount",
          "sign": 1,
          "source_scope": "fact_ledger",
          "selector": {
            "tags_any": [
              "direct_insurance_premium_receipt"
            ],
            "industry_exclusive": true
          },
          "occupancy_policy": "exclusive",
          "gross_or_net": "gross",
          "noncash_exclusions": [],
          "special_adjustments": [
            "仅按现金及现金等价物实际收付额列示"
          ],
          "restricted_cash_treatment": [
            "受限资金不满足现金及现金等价物定义时剔除"
          ]
        }
      ]
    },
    {
      "item_id": "CFO-I02",
      "name": "收到再保业务现金净额",
      "section": "operating",
      "display_order": 20,
      "verification_record_id": "FV-INSURANCE-FORMAT-2018-R2",
      "components": [
        {
          "component_id": "CFO-I02-C01",
          "operation": "net_fact_amount",
          "sign": 1,
          "source_scope": "fact_ledger",
          "selector": {
            "positive_tags_any": [
              "reinsurance_cash_received"
            ],
            "negative_tags_any": [
              "reinsurance_cash_paid"
            ],
            "positive_only": true,
            "industry_exclusive": true
          },
          "occupancy_policy": "exclusive",
          "gross_or_net": "net",
          "noncash_exclusions": [
            "非现金结算",
            "公允价值变动",
            "应计未收未付"
          ],
          "special_adjustments": [
            "仅按现金及现金等价物实际收付额列示"
          ],
          "restricted_cash_treatment": [
            "受限资金不满足现金及现金等价物定义时剔除"
          ]
        }
      ]
    },
    {
      "item_id": "CFO-I03",
      "name": "保户储金及投资款净增加额",
      "section": "operating",
      "display_order": 30,
      "verification_record_id": "FV-INSURANCE-FORMAT-2018-R2",
      "components": [
        {
          "component_id": "CFO-I03-C01",
          "operation": "net_fact_amount",
          "sign": 1,
          "source_scope": "fact_ledger",
          "selector": {
            "positive_tags_any": [